Company Name,Emails,Phone Numbers
Advanced Physical Therapy Specialists,Can't Scrape,Can't Scrape
Aiken Chiropractic Wellness Center Inc,Can't Scrape,Can't Scrape
Alpha Medical Clinic and MedSpa,Can't Scrape,Can't Scrape
Coastal Integrative Healthcare Inc,Can't Scrape,Can't Scrape
Dermatology & Cutaneous Surgery Institute Dcsi Pa,"info@mydcsi.com, info@mydcsi.com","561-469-6456, 561-637-8219"
East Orlando Medical Care Llc,Can't Scrape,Can't Scrape
Eyes of Winter Park Llc,see@eyeassociateswp.com,407-671-5445
Florida Retina Specialists PA,Can't Scrape,321-735-8800
Gulf Coast Holistic and Primary Care Inc,Can't Scrape,Can't Scrape
M & M Medical Enterprises Inc,Can't Scrape,888-535-6244
Space Coast Psychiatry Inc,Can't Scrape,Can't Scrape
Westchase Orthopaedics Inc,Can't Scrape,Can't Scrape
